{
  "version": "moral-trade-data-model-v0.1.3-2026-05",
  "purpose": "Public contract for the core Moral Trade domain entities, required fields, privacy classes, relationship boundaries, and non-claims named by the product audit.",
  "entities": [
    {
      "key": "participant",
      "label": "Participant",
      "category": "identity",
      "privacyClass": "authenticated_private",
      "requiredFields": ["id", "display_name", "roles", "created_at"],
      "relationships": ["public_profile", "private_wish_profile", "offer", "privacy_grant"],
      "publicExposure": "A participant appears publicly only through opted-in profile or offer preview fields."
    },
    {
      "key": "public_profile",
      "label": "Public profile",
      "category": "profile",
      "privacyClass": "public_preview",
      "requiredFields": ["profile_id", "display_name", "cause_area_previews", "trade_mode_previews", "visibility_control_id"],
      "relationships": ["participant", "profile_visibility_control"],
      "publicExposure": "Shows broad previews and chosen visibility only; exact wishes, contact details, private source notes, and sensitive constraints stay out."
    },
    {
      "key": "private_wish_profile",
      "label": "Private wish profile",
      "category": "profile",
      "privacyClass": "private_authenticated",
      "requiredFields": ["profile_id", "owner_id", "exact_wishes", "constraints", "verification_preferences", "updated_at"],
      "relationships": ["participant", "source_note", "saved_search", "privacy_grant"],
      "publicExposure": "Never public by default; fields can be summarized only through broad previews or explicit privacy grants."
    },
    {
      "key": "profile_visibility_control",
      "label": "Profile visibility control",
      "category": "privacy",
      "privacyClass": "private_authenticated",
      "requiredFields": ["id", "owner_id", "public_profile_id", "location_visibility", "profile_visibility", "updated_at"],
      "relationships": ["participant", "public_profile"],
      "publicExposure": "Publishes only the selected visibility level, not the hidden profile fields behind it."
    },
    {
      "key": "source_connection",
      "label": "Source connection",
      "category": "privacy",
      "privacyClass": "private_authenticated",
      "requiredFields": ["id", "owner_id", "source_kind", "consent_scope", "import_mode", "manual_summary", "updated_at"],
      "relationships": ["participant", "source_note", "private_wish_profile"],
      "publicExposure": "Stores consent scope, import mode, and manual summaries only; raw private feeds are not ingested or searched."
    },
    {
      "key": "source_note",
      "label": "Source note",
      "category": "privacy",
      "privacyClass": "private_authenticated",
      "requiredFields": ["id", "owner_id", "source_connection_id", "summary", "redaction_level", "created_at"],
      "relationships": ["source_connection", "private_wish_profile", "evidence_claim"],
      "publicExposure": "Only coarse source summaries may be disclosed through a valid purpose-bound grant; raw notes remain private."
    },
    {
      "key": "saved_search",
      "label": "Saved search",
      "category": "matching",
      "privacyClass": "private_authenticated",
      "requiredFields": ["id", "owner_id", "query_scope", "cause_filters", "filters_json", "notify_on_live_match", "source_route", "privacy_threshold", "created_at"],
      "relationships": ["participant", "private_wish_profile", "match_suggestion", "notification"],
      "publicExposure": "Search terms, offer browse filters, and notification choices remain viewer-owned; public search returns broad previews only."
    },
    {
      "key": "trade_format",
      "label": "Trade format",
      "category": "proposal",
      "privacyClass": "public_contract",
      "requiredFields": ["key", "label", "evidence_schema_key", "allowed_statuses"],
      "relationships": ["offer", "evidence_claim"],
      "publicExposure": "A public taxonomy for pledge swaps, donation offsets, paid actions, and public-good commitments."
    },
    {
      "key": "offer",
      "label": "Offer",
      "category": "proposal",
      "privacyClass": "public_or_private_by_status",
      "requiredFields": ["id", "participant_id", "format", "cause_areas", "offered_action", "requested_action", "expected_impact", "verification_method", "duration", "exit_conditions", "baseline_statement", "status"],
      "relationships": ["participant", "trade_format", "baseline_statement", "evidence_claim", "review_decision", "challenge", "appeal"],
      "publicExposure": "Public offers expose only reviewed or preview-safe terms and must not imply escrow, legal enforceability, tax treatment, or objective moral endorsement."
    },
    {
      "key": "baseline_statement",
      "label": "Baseline statement",
      "category": "proposal",
      "privacyClass": "review_scoped",
      "requiredFields": ["id", "offer_id", "no_trade_default", "prior_intent_evidence", "credibility_status", "review_scope"],
      "relationships": ["offer", "evidence_claim", "challenge"],
      "publicExposure": "The no-trade baseline is reviewable and challengeable; sensitive details can be summarized or redacted."
    },
    {
      "key": "evidence_claim",
      "label": "Evidence claim",
      "category": "evidence",
      "privacyClass": "review_scoped",
      "requiredFields": ["id", "proposal_id", "claim_type", "artifact_ids", "claim_scope", "reviewer_confidence", "uniqueness_checked"],
      "relationships": ["offer", "evidence_artifact", "review_decision"],
      "publicExposure": "Claims disclose only scoped summaries and confidence; artifacts and private locators stay behind review controls."
    },
    {
      "key": "evidence_artifact",
      "label": "Artifact",
      "category": "evidence",
      "privacyClass": "review_scoped",
      "requiredFields": ["id", "kind", "normalized_locator", "claim_scopes", "submitted_at", "redaction_level", "sha256"],
      "relationships": ["evidence_claim", "agreement_event"],
      "publicExposure": "Artifacts require hashes, scope alignment, and redaction levels before any public reasoning summary references them."
    },
    {
      "key": "external_entity_reference",
      "label": "External entity reference",
      "category": "provenance",
      "privacyClass": "review_scoped",
      "requiredFields": ["id", "entity_type", "identifier_system", "normalized_identifier", "dedupe_key", "verification_status", "redaction_level", "sha256"],
      "relationships": ["evidence_artifact", "traceability_event", "provenance_activity"],
      "publicExposure": "External charities, payment providers, registries, or supplier-like records expose only stable redacted identifiers after registry or reviewer confirmation."
    },
    {
      "key": "traceability_event",
      "label": "Traceability event",
      "category": "provenance",
      "privacyClass": "review_scoped",
      "requiredFields": ["id", "subject_id", "event_time", "recorded_at", "action", "business_step", "disposition", "what", "where_recorded", "why", "agent_ids", "redaction_level", "sha256"],
      "relationships": ["evidence_artifact", "external_entity_reference", "provenance_agent", "provenance_activity", "review_decision"],
      "publicExposure": "What/where/why event records can support payment, charity-routing, or external-evidence audits; raw artifacts and private provider payloads remain redacted."
    },
    {
      "key": "provenance_activity",
      "label": "Provenance activity",
      "category": "provenance",
      "privacyClass": "review_scoped",
      "requiredFields": ["id", "subject_id", "kind", "activity_at", "used_entity_ids", "generated_entity_ids", "agent_ids", "activity_hash"],
      "relationships": ["evidence_artifact", "evidence_claim", "review_decision", "provenance_agent", "traceability_event", "state_transition_event_record"],
      "publicExposure": "Activities link submitted, reviewed, and changed records to agents; public summaries omit raw private wishes, contact details, and source notes."
    },
    {
      "key": "provenance_agent",
      "label": "Provenance agent",
      "category": "provenance",
      "privacyClass": "review_scoped",
      "requiredFields": ["id", "owner_profile_id", "agent_key", "kind", "label", "redaction_level", "created_at"],
      "relationships": ["participant", "review_decision", "provenance_activity", "traceability_event", "state_transition_event_record"],
      "publicExposure": "Participants, counterparties, reviewers, operators, and providers are represented by scoped agent records; public labels require explicit redaction review."
    },
    {
      "key": "state_transition_event_record",
      "label": "State transition event record",
      "category": "provenance",
      "privacyClass": "review_scoped",
      "requiredFields": ["id", "subject_id", "from_status", "to_status", "provenance_activity", "actor_agent_id", "idempotency_key", "event_hash", "recorded_at"],
      "relationships": ["offer", "review_decision", "provenance_activity", "provenance_agent", "agreement_event"],
      "publicExposure": "Reliance-bearing status changes require immutable event hashes and agent links; public exposure is limited to redacted status evidence."
    },
    {
      "key": "review_decision",
      "label": "Reviewer decision",
      "category": "review",
      "privacyClass": "review_scoped",
      "requiredFields": ["id", "proposal_id", "outcome", "reason_codes", "summary", "reviewer_id", "created_at"],
      "relationships": ["offer", "evidence_claim", "challenge", "appeal", "agreement_event", "provenance_agent", "provenance_activity", "state_transition_event_record"],
      "publicExposure": "Only a narrow public reasoning summary is exposed when safe; private notes and source notes are redacted."
    },
    {
      "key": "challenge",
      "label": "Challenge",
      "category": "review",